issue,has_embedding
Should parents be allowed to opt out of sex education for their children?,True
Should the UK and France share the Channel Tunnel?,True
Should we reintroduce wolves into the Scottish Highlands?,True
"Is it okay to use genetic engineering to give babies genetic enhancements, such as improved intelligence, strength and beauty?",True
Should the government require internet companies to censor what people can see?,True
Is it better to give everyone a basic income or would it be better to give everyone a certain amount of money to invest in their own education?,True
Should the government use more public money to help reduce childhood obesity?,True
Should there be a free university education?,True
Is it a good idea to give everyone free broadband?,True
Is the government doing enough to address the growing inequality gap?,True
Should we increase funding for police and prisons?,True
Should the government spend more on science and technology research?,True
Should Britain remove the statue of Winston Churchill from Parliament Square?,True
Should companies that operate in countries with human rights abuses be allowed to sell their goods in the UK?,True
Do we have enough houses for the people who live in the UK?,True
Should it be a criminal offence to feed your dog chocolate?,True
Should students be required to pass a literacy and numeracy test before graduating from primary school?,True
Should we have compulsory voting in national elections?,True
Should the UK continue to license radio frequency spectrum for use by the general public?,True
Should companies be required to pay a living wage?,True
Should we tax sugary food to encourage healthier eating?,True
Should we increase the tax on petrol and diesel?,True
Should we allow people to buy and sell organs on a market?,True
Should we require people to pay a fixed tax on any amount of wealth they own above £10 million?,True
Should we ban all smoking in public places?,True
Should Scotland become independent from the rest of the UK?,True
Should we require all companies with over 100 employees to publish data on their pay gap between women and men?,True
Is it important to preserve old buildings and historical places?,True
Should the UK government subsidize local football clubs?,True
should the legal working week be reduced for parents?,True
Should we be allowed to donate organs from the dead to save lives?,True
Is it okay for the police to use facial recognition systems?,True
Should the minimum wage be abolished?,True
Should we raise the age at which people can drink alcohol to 25?,True
Do we need to increase the number of teachers in the education system?,True
Are electric cars really the best alternative to petrol-powered cars?,True
Should there be more taxes on cigarettes and alcohol?,True
Should we stop producing nuclear power?,True
Should we ban all single-use plastics?,True
Is it ethical to use animals for scientific research?,True
Should people who make over £1 million per year be taxed at a higher rate?,True
Should we raise the top rate of income tax to 55%?,True
Should there be more or less government funding for primary schools?,True
Should parents be required to attend parenting classes in order to qualify for a child allowance?,True
Is a nuclear weapons ban possible?,True
Is it okay to eat dogs?,True
Should we increase funding for public education?,True
Should the UK's internet providers be required to record and store a record of what people do online?,True
Should we allow parents to take children out of school on the basis of religious grounds?,True
Should we prohibit all advertising that promotes unhealthy eating?,True
Should the government allow local authorities to ban the use of diesel cars?,True
Is it okay for people to walk their dogs on the beach during the summer?,True
Do we have a moral obligation to give aid to the poor abroad?,True
Is it OK to genetically modify animals?,True
Should students be allowed to have cellphones in class?,True
Should the UK military be allowed to go on missions abroad to enforce peace and humanitarian aid?,True
Is the UK too reliant on foreign oil?,True
Does capitalism help improve people's lives?,True
Should we send more aid to Africa?,True
Should the government be allowed to force landlords to lower rent?,True
"Would it be better for society if everyone worked an 8-hour day, 5 days a week?",True
Should people be allowed to smoke marijuana?,True
Should we give all young people aged 16-18 a full driving license and car?,True
Is the government failing to tackle child obesity?,True
Is it okay for a company to sell a facial recognition system to a country where they will be used to track political dissidents?,True
Is it ever morally acceptable to lie to your children?,True
Should people be encouraged to buy a home in London?,True
Should the UK reduce immigration?,True
Should the UK withdraw from the World Trade Organisation?,True
Should we ban smoking?,True
Should cannabis be legalised?,True
Should the Royal Mail remain a government owned institution?,True
Is it wrong to send your child to a private school?,True
Should it be illegal for politicians to accept gifts from donors?,True
Should we introduce a basic income?,True
Is the NHS doing enough to improve the health of the average person?,True
"Should the BBC have a public service obligation to inform, educate and entertain all citizens?",True
Do the rich in the UK have an obligation to help the poor in the UK?,True
Would it be better to have a President rather than a Prime Minister?,True
Should we end subsidies for renewable energy?,True
Should we restrict the use of social media and search engines in schools?,True
Should Britain ban pesticides to protect bees?,True
Should the Government build a bridge to Northern Ireland?,True
Should we allow investement from the Chinese state in our high speed railway?,True
Should the voting age be reduced to 16?,True
Should we ban certain types of plastic to help the environment?,True
Are we living in a golden age of democracy?,True
Should the UK government subsidize sports in state schools?,True
Should we provide the public with greater access to information about their government?,True
Is the United Kingdom still a world power?,True
Should the UK government ban the sale of plastic bags?,True
Should the government help the poor and the elderly more than it does now?,True
"Should we build more roads in the UK, even if it means we have to cut down a lot of trees?",True
Should all new homes be required to have solar panels?,True
Should the royal family be paid by the government?,True
Should we ban smoking in all outdoor public places?,True
Does climate change pose a threat to the UK?,True
Should there be a cap on university tuition fees?,True
Should the Royal family be funded by the taxpayer?,True
Should we introduce a 4-day working week?,True
Will people be able to live in a space station in orbit in the next 50 years?,True
Should people be allowed to grow cannabis plants in their garden?,True
Should we be using new gene editing techniques to prevent children being born with genetic disorders?,True
Is the world a better place than it was before the internet?,True
"Is it ok to use algorithms that estimate the probability that an individual is going to commit a crime, and use that probability to determine the severity of the punishment?",True
Should parents be allowed to opt their children out of sex education?,True
Should all religious schools receive some public funding?,True
Should people be allowed to bring dogs into restaurants?,True
Should the BBC be publicly funded?,True
Should governments subsidise arts and culture?,True
Should the UK tax land at a higher rate than other forms of capital?,True
"Should all students at universities in the UK be required to take classes in basic mathematics, science, and technology?",True
Should everyone have to learn a foreign language?,True
"Should we have a more progressive tax system, where the wealthy pay a higher percentage of their income?",True
Should we ban smoking in private vehicles?,True
Is it ok to buy products from countries with poor human rights records?,True
Is it okay for the government to prohibit people from traveling to countries that are deemed unsafe?,True
Should we adopt a system of universal basic income (UBI) in which every adult citizen is guaranteed a minimum income?,True
Should we reduce the voting age to 12?,True
Do you think we should legalise cannabis for recreational use?,True
Should countries be able to impose tariffs on imported goods?,True
Should we have greater controls over the use of pesticides?,True
Is the current model of global capitalism exploitative and unsustainable?,True
Should the government spend money on helping children with reading and writing skills?,True
Should all schoolchildren receive a free daily hot meal?,True
Is it ever acceptable for the police to break up peaceful demonstrations?,True
Should the UK build a new generation of nuclear power stations?,True
Should people who do not wear face masks in shops (except those exempt) be fined?,True
Should we establish a new regulatory framework for fracking?,True
Should the government encourage the growth of wind power?,True
Does the media have a responsibility to report things accurately?,True
Should there be a maximum amount of time a person can hold public office?,True
Is it acceptable to use animals to test the effects of new chemicals?,True
Do humans have an innate ability to be moral?,True
Should we limit the amount of money that people can donate to political campaigns?,True
Should people be allowed to keep exotic animals as pets?,True
Should we ban single use plastics?,True
Should we stop giving aid to foreign countries?,True
Should we ban the import of food from countries that allow animal testing?,True
Should children have the right to choose their own school?,True
Should the government provide free life-saving treatment to any child who needs it?,True
"Should the state make it easier for people to buy their own home, even if that means higher taxes for those who already own their own homes?",True
Should we support the European Union?,True
Is the global north at risk from terrorism?,True
Should we give every 16-year-old a free laptop?,True
Should the UK recognise Palestine as a country?,True
Should the government reduce the amount of money it spends on policing?,True
Are there too many tourists visiting the UK?,True
Should we make employers legally responsible for improving their employees’ physical and mental health?,True
Should the UK stop using pounds and convert to the euro?,True
Is it okay to build a new airport in the area of a nature reserve?,True
Should all parents have the right to tell their children what school to go to?,True
Is there an oversupply of university graduates in the UK?,True
Are we as a society doing enough to fight climate change?,True
Should the UK invest more in large-scale infrastructure projects?,True
Should we require all citizens to vote in elections?,True
Would it be a good idea to have 'no-fly' zones where people are not allowed to fly an airplane?,True
Do we need a tougher legal framework to stop animal poaching?,True
Should we ban all pesticides and herbicides from agricultural use?,True
Are taxes too high?,True
Should we require a mandatory 2 year post-graduate term of national service for all those between 18 and 30?,True
Should the state subsidise the arts?,True
Should we ban the use of animals in circuses?,True
Does the British Broadcasting Corporation still serve a valuable function in society?,True
Should we all have to wear clothes when we are outdoors in public?,True
"Should the government pay to send students to school, or should students pay to go to school?",True
Should the government restrict the type of cars people can drive?,True
Should we make divorce harder?,True
Should the government provide free health care to all citizens?,True
Should the government do more to help unemployed people find jobs?,True
Should we have a law banning the use of plastic bags?,True
Is the use of fossil fuels doing more harm than good to the economy?,True
Should we change the age at which a person is legally considered to be an adult?,True
Should people be allowed to buy drugs on the internet?,True
Should the United Kingdom be actively trying to promote British culture abroad?,True
Would it be better if the UK were part of the European Union?,True
Should we ban gambling on sporting events?,True
Should parents ever be prosecuted if their children fail to attend school?,True
Should we remove the right of landlords to evict tenants?,True
Should we get rid of compulsory education for children?,True
Should we ban the sale of new vehicles with petrol or diesel engines?,True
"Should the UK’s national flag feature the English St. George’s Cross, the Scottish St. Andrew’s Cross, the Irish St. Patrick’s Cross, and the Welsh Dragon?",True
Should government spend less money on education and more on prisons?,True
Is it fair to imprison someone for committing a crime that they did not realize was a crime?,True
Should the minimum age for drinking alcohol be increased to 21?,True
Should we fund more research into climate change and less into diseases such as dementia?,True
Should anyone under the age of 18 be permitted to consume alcohol?,True
Should we have more or fewer migrant workers to the UK?,True
Are there any limits to freedom of speech?,True
Should the UK government invest more in making renewable energy cheaper?,True
Should we allow genetically modified crops?,True
Should we make it more difficult to get a divorce?,True
Should the BBC have a bigger or smaller budget?,True
Is it right for the UK to use some of the money from taxes to help poor people in other countries?,True
Is it the government’s role to ensure that the National Health Service is sustainable for future generations?,True
Should the government regulate the level of salt in processed food?,True
Should we increase taxes to reduce inequality?,True
Should the UK fund charities?,True
Should all employers be required to offer flexible working arrangements to employees with childcare responsibilities?,True
Should we have a four-day work week?,True
Is the UK becoming less tolerant of free speech?,True
Should sex work be criminalised?,True
"Should we keep cash and cheques, or move entirely to electronic payment?",True
"Do you have an ethical duty to donate blood, bone marrow, or organs?",True
Should we ban tax-free shopping?,True
Should there be a universal basic income in the UK?,True
Is it ever permissible to use your body to block another person's way?,True
Should we be providing more subsidised childcare?,True
Should the UK invest in a high-speed rail line between its major cities ?,True
Should we invest more in renewable energy over traditional energy sources?,True
Should people in the UK be allowed to sue the government if they have been wrongfully convicted?,True
is it better for British people to buy british products?,True
Should all people have access to the internet?,True
Should the NHS pay more attention to the long-term consequences of prescribing certain drugs?,True
Should the National Health Service (NHS) be privatised?,True
Should universities try to attract more overseas students?,True
Should we spend more money on the arts?,True
Should all politicians have to declare their true income in parliament?,True
Should the government subsidise travel to make it more affordable?,True
Is it okay for adults to do drugs at parties?,True
Should we use more of the UK's land to grow food?,True
Should the UK implement policies that lead to a population increase?,True
Should the government regulate how businesses use Artificial Intelligence systems?,True
Is it right to keep animals in zoos?,True
Is it ok for the government to track people using GPS and CCTV technology?,True
Should we have a basic income?,True
Should countries develop more solar and wind energy?,True
Should the UK have fracking for shale gas?,True
Should we put more money into the National Health Service?,True
Are car manufacturers responsible for the emissions their cars produce?,True
Should the government intervene in the housing market by offering subsidies to those who want to buy their first house?,True
Is it okay to own a social creature like a dog as a pet if you cannot commit to walking it at least twice a day?,True
Should parents have the right to know when their children have received contraception?,True
Is it a good idea to reduce the voting age to 16?,True
Should we allow more competition between banks in the UK?,True
Should a country's success be measured by how equal that society is?,True
Should we subsidize the purchase of solar panels?,True
Should we raise taxes on second and third home purchases?,True
Will Scotland ever become independent?,True
Should we do more to tackle climate change?,True
Is government surveillance technology a net positive for humanity?,True
Should all students at state schools be able to attend university for free?,True
Is the UK National Health Service better than the US health care system?,True
Should we increase taxes to spend more on our health service?,True
Should the UK government subsidize the construction of low-cost housing?,True
Has the government done enough to tackle online disinformation?,True
Should the law be changed to make it easier for companies to hire people for short periods of time?,True
Is the government doing enough to combat homelessness?,True
Should there be more or less public spending on health?,True
Should we introduce a law that says all adults must vote in all elections?,True
Should all supermarkets be legally required to charge the same price for the same product?,True
Should there be restrictions on the right to demonstrate?,True
Should we legalise recreational cannabis use?,True
Should we remove all the gender-based words from our language?,True
Should the UK provide some sort of subsidy to poorer parts of the UK?,True
Is there value in allowing privately-owned media?,True
"Should people who earn more than £250,000 a year pay more tax?",True
Should we subsidize electric cars?,True
Should there be tighter restrictions on what can be posted on social media?,True
Should the government fund more public art in the UK?,True
"Would the UK economy function better if we had a basic income of £10,000 per year?",True
Should we ban the smoking of cigarettes in public places?,True
Should we increase the tax on new cars to make it more expensive to own a car?,True
Should parents be fined for sending their children to private school?,True
Should we do more to combat climate change?,True
Should we have more nuclear power plants?,True
Is artificial intelligence going to be a net positive or a net negative for humanity?,True
Should we make it easier for people to become teachers?,True
Should people who can't pay their mortgage have their house repossessed?,True
Should we continue to subsidise the arts?,True
Should we use tax money to fund a universal basic income?,True
Is the UK doing enough to stop global warming?,True
Should the UK have a free trade agreement with the US?,True
Has the spread of mobile technology improved the quality of people's social lives?,True
Should parents be allowed to make medical decisions for their children?,True
Should the government invest more in infrastructure?,True
Should people be allowed to pay for a better education for their children?,True
Should all citizens vote on laws?,True
Should we raise the age for buying alcohol to 25?,True
Should people be entitled to free public transport?,True
Do the benefits of vaccination outweigh the risks?,True
Should all primary and secondary schools be free?,True
Should we try to reduce the amount of meat we eat?,True
Should we abolish all school league tables?,True
Should we encourage young people to be entrepreneurs?,True
Should the government restrict how many calories can be in a sugary drink?,True
Should we keep the electoral system we currently have?,True
Should the government intervene to make sure that employees of more successful companies are paid more generously?,True
Has the introduction of the smoking ban in pubs been a good thing?,True
Should it be illegal for foreign nationals to be employed in jobs that could be done by UK nationals?,True
Should people be allowed to keep wild animals as pets?,True
Should all public land be made available for public use?,True
Is it acceptable for the government to use propaganda to shape public opinion?,True
"Should we introduce a third party to ensure that the British Broadcasting Corporation is providing a fair, balanced and impartial coverage of politics?",True
Should we take a more active role in helping the less well-off countries?,True
Should the UK impose a ban on selling cars that run on fossil fuels?,True
Should parents be allowed to gift their estates to their children?,True
Is it OK to drive across the country to visit a friend despite the carbon cost?,True
Should we build more new nuclear power stations?,True
Should the government enforce a carbon tax on businesses?,True
Should we ban the production of food products containing palm oil?,True
Should we allow people to rent out spare rooms in their homes as Airbnb-style hotels?,True
Should people have the right to use e-cigarettes in public places?,True
Are people more productive when they work from home?,True
Should we have a maximum wage?,True
Should there be restrictions on the number of children a person can have?,True
Should people who do not have UK citizenship be allowed to vote in UK elections?,True
Should people in the UK be encouraged to use a bicycle to get to work?,True
Should new roads be built to relieve congestion on a major route through a city?,True
Should all people be able to legally immigrate to the UK?,True
Should we increase the state pension age?,True
Does the UK have a moral duty to admit more refugees?,True
Should we ban all single-use packaging of consumer goods?,True
Should the government limit the number of TV channels a satellite TV company can provide to just the four free-to-air channels?,True
Should we get rid of all laws and start from scratch?,True
Should the Prime Minister's office be open to the public?,True
Is there too much inequality in the United Kingdom?,True
Should we ban the export of all animal products?,True
Should there be a higher tax on unhealthy foods?,True
Should the government require all houses to have solar panels?,True
Should the government ban certain political parties from participating in elections?,True
Should the state pay for couples to freeze their sperm or eggs so they can have children when they are older?,True
Should the government support artists and their work?,True
Should the Government reduce the tax rate on cigarettes?,True
Should we ban large stores from selling food items that are considered unhealthy?,True
Should the UK tax on sugar be increased to help reduce childhood obesity?,True
Should the government subsidize the airline industry?,True
Should it be mandatory to wear a helmet while cycling?,True
Should we introduce a new public holiday to commemorate the UK’s exit from the EU?,True
Is the government doing enough to protect us from climate change?,True
Should companies be required to tell you where your clothes were made?,True
Should there be an independent Scotland?,True
Should we ban the building of wind turbines on the UK's shoreline?,True
Should we allow more fracking for gas?,True
Should the BBC be abolished?,True
Should the government ban eating meat in order to save the planet?,True
Is the quality of life in the UK higher or lower than it was 50 years ago?,True
Should more effort be put into encouraging people to vote?,True
Should the UK government subsidize petrol so that prices are cheaper for drivers?,True
Should we allow fracking for shale gas in the UK?,True
Should we ban the consumption of meat?,True
Should we make it easier for people to become citizens of the UK?,True
Should we ban non-essential plastics from supermarkets?,True
Should we give the EU access to UK fishing waters?,True
Should the government subsidise music lessons for low income families?,True
Should we require companies to give their workers a shorter working week?,True
Should university students have to pay fees to attend university?,True
Is capitalism in its current form morally defensible?,True
Should corporations be allowed to buy and sell the rights to use people’s data for advertising?,True
Should we create council housing that no one can buy?,True
Should the government set minimum wages?,True
Should police be allowed to stop and search a person for no reason at all?,True
Should we give up the Pound and join the Euro?,True
Should the government subsidize (give money to) oil and gas companies to produce fossil fuels?,True
Should the government provide greater support to parents to help children from poorer families achieve in school?,True
Should we change the UK flag?,True
Should we have a second referendum on Scottish independence?,True
Should the government introduce a universal basic income?,True
Should we use animals for medical research?,True
Should the government set a minimum price for alcohol?,True
Is the internet a force for good or evil?,True
Should people have the right to smoke in their own homes?,True
Is it possible to get to know another person well enough to know whether or not they are a good person?,True
Should the government allow a new oil refinery to be built on the coast?,True
Should the government increase the size of the armed forces?,True
Should we change our electoral system?,True
Do we need to reduce the amount of money that's spent on healthcare?,True
Should the government subsidise businesses so that they can expand and create more jobs?,True
Should we allow the creation of “designer babies”?,True
Is it acceptable for companies to sell data about the individuals?,True
