issue,has_embedding
Will the UK reduce the number of days a year on which a person is allowed to work?,True
Should it be possible for you to legally download copyrighted material from the internet for free?,True
Should we adopt a four-day working week?,True
Should there be more or less government involvement in health and safety?,True
Does the state have a role in reducing obesity in children?,True
Should the UK stop issuing £50 notes?,True
Should the government ban the purchase of large private cars in order to reduce air pollution?,True
Is it appropriate for doctors to prescribe medical marijuana?,True
Should the UK abolish private schools?,True
Should we ban the sale of gasoline and diesel powered cars by 2035?,True
Should all children in schools receive a free laptop?,True
Should it be possible to sue doctors who prescribe drugs with the knowledge that the drugs are dangerous?,True
Should parents be allowed to leave children in the care of their grandparents while they go on holiday?,True
Should people who use public transport be fined if they take up too much space with their personal items?,True
Should the government invest more in railway infrastructure to help improve public transport?,True
Is it ever morally permissible to tell a white lie?,True
Is the internet a public utility?,True
Will artificial intelligence ever match human intelligence?,True
Should we have national referendums on major issues?,True
Is it ever morally permissible to lie?,True
Should the government support businesses by reducing taxes on business income?,True
Should we cut the number of students accepted to UK universities?,True
Is it ever OK for a politician to ask an aide to do a personal favour?,True
Should people be fined for littering in public places?,True
Should we have a new nuclear power station?,True
Should the government ban the sale of new petrol cars in 2030?,True
Should parents have access to their children's school emails and chats?,True
Should the UK maintain its membership in the UN?,True
Should we restrict the use of algorithms in making hiring decisions?,True
Should we ban junk food adverts during children's TV programmes?,True
"Should the UK adopt a universal basic income of £10,000 per adult per year?",True
Should prostitution be legal?,True
Should there be a maximum limit to the amount of money that people can inherit?,True
Should the government use tax revenues to provide people with basic income?,True
Should a vegetarian diet be compulsory in primary schools?,True
Should the private sector play a greater role in education?,True
Should the UK have its own cryptocurrency?,True
Are the rules about acceptable content in online advertising too restrictive?,True
Should we allow employers to ask job applicants for their credit score?,True
Should we restrict foreign investment in domestic industries?,True
Should companies be obliged to report on the ethnicity pay gap?,True
Should a new nuclear power station be built at Hinkley Point?,True
Should it be illegal to say things that are false about other people?,True
Should we build a third runway at Heathrow Airport?,True
Is it okay for people to smoke in public parks?,True
Should it be illegal to use mobile phones while driving?,True
Should more be done to help combat climate change?,True
Should we ban all single-use snack containers?,True
Do you think the government should provide free medical care to all citizens?,True
Should we stop using disposable plastic?,True
Should we ask the public to vote for laws?,True
Should prisons be allowed to use solitary confinement?,True
Should we abolish or reduce university tuition fees?,True
Should we remove statues of people associated with slavery?,True
Would it be good for the UK to join the Eurozone?,True
Does it make sense to pay people more for working at night?,True
Is it a good idea to build a high-speed rail line between London and Scotland?,True
Do we need to be concerned about climate change?,True
Should the BBC be a public service broadcaster or a commercial broadcaster?,True
Should we build new nuclear power plants?,True
Does free trade make the world a better place?,True
Should the UK government fund a new high-speed rail link between London and Edinburgh?,True
Should we significantly increase the use of renewable energy sources?,True
Should we change the way that we vote in UK elections?,True
Should all university education be provided at no cost?,True
Should the government do more to encourage people to eat healthily?,True
Is the UK government morally justified in collecting taxes to fund public healthcare?,True
Should the government allow the sale of non-medicinal recreational drugs?,True
Is it wrong to sell organs for transplant?,True
Should there be term limits for elected officials?,True
Should it be legal to sell e-cigarettes to people under 18?,True
Should the government take a share of a large lottery win?,True
Is it ok for the UK government to tax people who earn a high salary at a higher rate than people who earn a lower salary?,True
Should the minimum age for buying cigarettes be raised from 18 to 21?,True
Should parents have the right to choose their children’s schools?,True
Is it okay to have laws against hate speech?,True
Should we increase taxes to fund a more comprehensive benefits system?,True
Should the government enforce compulsory national service?,True
Are there any limits on what can be allowed to be broadcast on television?,True
Would it be a good idea for the government to regulate the amount of sugar that can be put into any soft drink sold in the UK?,True
Should we be concerned about the future of the National Health Service?,True
Would it be a good idea to make the minimum wage much higher?,True
Should we adopt a universal basic income policy?,True
Should we spend more on mental health services?,True
Should we ban the import of single use plastics from China?,True
Is it right to spend £15 billion on high speed rail links betweeb cities outside London?,True
Should we encourage elderly people to work longer?,True
Should we make it illegal for a person to leave their partner or spouse?,True
Should the number of referendums be reduced in the UK?,True
Should the UK allow for the commercial sale of cannabis?,True
Are our brains like computers?,True
Should we provide housing for all homeless people?,True
Is it okay to take away a child from its parents because of their lifestyle?,True
Should there be a maximum wage in the UK?,True
Is it ok to do business in countries with repressive regimes?,True
Should the government ban all animal products?,True
Should the UK have a new runway at Heathrow?,True
Should we increase the length of time required for a divorce by mutual consent from 2 to 5 years?,True
Should we increase the tax on sugary drinks to reduce obesity?,True
Should the UK increase taxes on high income earners?,True
Are the long term risks from radioactivity from nuclear power plants greater than the short term benefits from the generation of electricity?,True
Is the NHS a socialist institution?,True
Do humans have a right to use animals for food?,True
Are celebrities treated too harshly by the media?,True
Should we ban all plastic straws?,True
Should the government impose tariffs on imported goods?,True
Should we raise the maximum age for leaving school to 18?,True
Should doctors prescribe medical cannabis?,True
Is immigration good for the UK economy?,True
Should we ban the sale of diesel cars by 2023?,True
Should the UK remain a member of the United Nations?,True
Should the Government encourage immigration into the UK from the EU?,True
Should parents be able to withdraw their children from sex education?,True
Should we ban pesticides?,True
Is the UK's National Health Service one of the best health systems in the world?,True
Should the BBC be legally compelled to be politically neutral?,True
Should the UK government ban the sale of fur?,True
Should the UK spend less on defence and more on the NHS?,True
Is the use of marijuana by non-medical users beneficial?,True
Should the government restrict the number of people that can enter the UK from other countries?,True
Is the move to a four-day working week something we should be looking at?,True
Do companies that use social media for advertising provide a societal benefit?,True
How important is it to save energy and recycle resources?,True
Should all children learn how to code?,True
Should we be spending more on the police and armed forces to improve security in the UK?,True
Should people have the right to smoke marijuana for medical purposes?,True
Should the UK adopt a higher tax on the use of plastic bags?,True
Is it ethical to use artificial insemination to allow a parent to have a child with some of their own DNA?,True
"If we could extend human life by 50 years, should we do it?",True
Is there a benefit to teaching children to learn foreign languages?,True
Is it fair to ask employers to pay for childcare when both parents are working?,True
Has the rise of the Internet caused loneliness?,True
Should companies be allowed to use artificial intelligence to select candidates for recruitment or promotion?,True
Should Scotland be given a second referendum on independence?,True
Should the UK impose tariffs on goods from the EU?,True
Should the state fund the arts?,True
Should we increase taxes on the wealthy?,True
Are new nuclear power plants a good idea?,True
Should we increase or decrease the number of migrant workers allowed into the UK?,True
Do we need to limit the number of hours people can work to prevent overworking and the ensuing health issues?,True
Should we make it easier for people from outside the UK to immigrate here?,True
Should it be illegal to lie to a parliamentary select committee?,True
Will Brexit ultimately prove to be a good thing for the UK?,True
Should every local authority offer every child a free school meal?,True
Should we spend more or less on the NHS?,True
Should the government increase the amount of solar energy produced in the UK?,True
Should Scotland leave the UK?,True
Should businesses be encouraged to find a way to recycle their products?,True
Are the benefits of free public transportation worth the cost?,True
Should we ban the use of all plastic products?,True
Should we have a law against bullying at school?,True
Is the current healthcare system too bureaucratic?,True
Should the UK government make a commitment to reduce the number of people without homes by at least 10% each year?,True
Should we increase investment in renewable energy?,True
Should people who use more than their fair share of electricity or other public utilities be forced to pay higher rates?,True
Is it okay to use disposable plastic cups at a social gathering?,True
Should the government ban plastic straws?,True
Should the UK continue to provide development aid to African nations?,True
Should the UK allow dual citizenship?,True
Should the UK use prison sentences to discourage behaviour?,True
Should we allow the creation of human-animal hybrids through genetic engineering?,True
Should universities be allowed to ban speakers on their campuses?,True
Should we build more houses in the UK?,True
Should the government offer subsidies to make housing more affordable?,True
Should we tax plastic bags at checkout?,True
Should a tax on sugar be implemented to reduce the number of obese people in the country?,True
Should the state subsidize parents who choose to homeschool their children?,True
Should we increase public transport fares and use the extra revenue to provide free public transport for certain people?,True
Should the government ban certain websites from the Internet?,True
Is there anything that can be done to lower house prices in the UK?,True
Should the UK have a Universal Basic Income?,True
"Is there a need for stricter regulation of the tech industry, to reduce levels of harmful content online?",True
Should the UK government ban the manufacture of new diesel vehicles?,True
Is it a good idea to ban advertising in children's programs?,True
Should we introduce Universal Basic Income (UBI)?,True
Should all UK workers have access to four weeks paid holiday?,True
Should we legalize the cultivation and consumption of magic mushrooms?,True
Should we ban the sale of diesel and gasoline vehicles?,True
Is the 'dark web' more of a threat to humanity than it is a liberator?,True
Should students who have a higher education be obliged to do a year of national service?,True
Should voting be mandatory?,True
Should the UK have a more generous asylum seeking policy?,True
Should the UK government subsidize the arts?,True
Is the UK a feminist country?,True
Will we ever eradicate malaria?,True
Should the UK allow for-profit organizations to run schools?,True
Should the BBC continue to receive funding from the government?,True
Should we be concerned that many jobs are now being performed by robots?,True
"Should we spend more money on healthcare, or should we spend more on other public services, like education?",True
Is it worth trying to reduce inequality?,True
Is the minimum wage a good thing?,True
Should we ban single-use plastics in the UK?,True
Should the government pay for healthcare and education?,True
Does it make sense to use artificial sweeteners in drinks?,True
Is the world going to get worse as Artificial Intelligence systems become more advanced?,True
Is it acceptable for the government to fund projects aimed at reducing inequalities between regions of the UK?,True
Should people be able to sell their organs to be used in transplants?,True
Should we build a new international airport?,True
Is the UK's economy better off outside the European Union?,True
Should the government fund research into educational programs how to make humans smarter?,True
Will the UK ever be able to stop buying oil from Middle Eastern countries?,True
Should the government be allowed to pass a law forcing people to pay a tax to reduce the risk of catastrophic climate change?,True
Should the government spend money on projects that create temporary jobs?,True
Should the UK seek to re-join the EU?,True
Should we have a general election?,True
Is it the responsibility of the government to fund and create more free parking spaces?,True
Should the government subsidise the use of solar energy?,True
Should students who receive student loans have to pay interest on them?,True
Is it right to increase the tax rate on the top 1% of earners?,True
Are video games art?,True
Should the Government fund research into cloning?,True
Should we allow the use of mobile phones in schools?,True
Will we ever develop telepathy as a useful communication medium?,True
Is the UK more or less liberal than the US?,True
Is it okay to invest in a company that manufactures weapons for military use?,True
Should we require all public transport to be free?,True
Should we cut the minimum voting age to 14?,True
Is there a place for the monarch in contemporary society?,True
Should the government subsidize solar panels for individual houses?,True
Should we build more nuclear power stations to meet our energy needs?,True
"Should we increase taxes on people who earn more than £150,000?",True
Should we lower the voting age to 16?,True
Should there be more public ownership of utility companies?,True
Should we ban new-build coal power stations?,True
Should the UK expand its current network of nuclear power plants?,True
Are people who hold high political office and have a significant influence on public life ethically required to disclose details about their family wealth?,True
Should the BBC be funded by a TV licence or from general taxation?,True
Should parents be obliged to send their children to school?,True
Should we expand our reliance on nuclear power as we phase out fossil fuel energy production?,True
Is Britain's tax burden too high?,True
"Is it right to have different policies for England, Scotland, Wales and Northern Ireland?",True
Should there be stricter penalties for animal cruelty?,True
Is it right to have compulsory voting?,True
Does the UK have too much influence over its ex-colonies?,True
Should universities be allowed to ban speakers with views they dislike?,True
Should the government encourage businesses to hire more women in senior positions?,True
Should we increase our defence spending?,True
Should we have a maximum and minimum wage?,True
Should universities allow students to submit their essays in voice recordings?,True
Should there be a ban on plastic cups and cutlery?,True
Should the Government increase taxes to reduce the deficit?,True
Does the government need to subsidize university tuition?,True
Should there be a minimum price per unit for alcohol?,True
Is it OK to use animal products at all for beauty care?,True
Should we ban smoking completely?,True
Should we implement free early childhood education?,True
Should we reduce the voting age from 18 to 16?,True
Is it reasonable to ban online trolling from social media?,True
Are the NHS and the UK welfare state fit for purpose?,True
Should the UK aim to achieve carbon neutrality by 2030?,True
Should we put up signs in our libraries indicating that the use of cellphones is not permitted?,True
Should the government make it harder for people to sue companies over product liability?,True
Should we have a minimum unit price for alcohol?,True
Should the UK government spend more on the NHS?,True
Should the government give out cash payments to all residents?,True
Will there ever be a cure for the common cold?,True
Are there any circumstances in which it's okay to lie?,True
Is it important to maintain a strong defence force in the UK?,True
Should the government do more to help the homeless?,True
Does the UK need a minimum wage?,True
Is it a good idea to replace the pound with the Euro?,True
Should the government put restrictions on the maximum amount of money people can earn in order to reduce inequality?,True
Should all children in the UK be taught to play a musical instrument?,True
Should the state provide free childcare?,True
Should parents be fined if their children fail to attend school?,True
Is it ethical for a person to live in a way that harms the environment?,True
Should parents be allowed to give babies away without the approval of a judge?,True
Will we ever solve climate change?,True
Should we reduce the voting age to 16?,True
Should all schools be forced to have a uniform policy?,True
Should voting be compulsory?,True
Should the UK allow foreign companies to build 5G networks in the UK?,True
Do the benefits of fracking outweigh the environmental risks?,True
Should we require that all drugs be tested before they are licensed to ensure they are safe?,True
Should we ban the production of all types of electric cars?,True
Is a carbon tax the best way to deal with climate change?,True
Should we make all single-use drink containers biodegradable?,True
Should the UK's ties to Europe be stronger or weaker?,True
Should the government spend more money on building new hospitals?,True
Are there limits to how much tax people should have to pay?,True
Should the government allow large supermarket chains to expand their retail footprint?,True
Should we require people to wear face masks?,True
Should we implement a four-day workweek?,True
Should we stop teaching history because it glorifies people and nations who did bad things?,True
Is it okay for parents to send their kids to private school?,True
Do we need more nuclear power plants?,True
Should we accept foreign exchange students to attend state schools?,True
Should we renationalise the electricity network?,True
Does the UK need a space programme?,True
Should the UK continue to subsidise fossil fuel industries?,True
Should the UK keep the pound or should it join the Euro?,True
Should the government ban the use of animals in research?,True
Should we prohibit mobile phones from being used in cars?,True
Should it be compulsory to vote in local elections?,True
Are the benefits of Brexit going to outweigh the costs?,True
Do we have a responsibility to act to prevent future pandemics?,True
Should we require that people who have pets sterilize them before adopting them?,True
Should the government intervene to help businesses or the self-employed who are in debt because of a change in trading circumstances caused by the Covid-19 virus outbreak?,True
Should the UK have a minimum wage?,True
Should the government increase the taxes on carbon?,True
Should the UK government make more use of artificial intelligence to detect fraud in the welfare system?,True
Should the UK pay its fair share to help poorer countries reduce poverty?,True
Should everyone receive a basic income?,True
Should we ban smoking in all public places?,True
Should we subsidize renewable energy companies to increase their production?,True
Should we be encouraging more immigration to the UK?,True
Should we make access to university free for all students?,True
Should there be a universal basic income (UBI)?,True
Should we ban the breeding of animals for the meat industry?,True
Should we have a special tax for unhealthy food?,True
Should the government subsidise the arts?,True
Should all companies in the UK be required to report on the gender pay gap?,True
Should we make it mandatory to recycle?,True
"Is the smoking ban in pubs, bars, and restaurants a good thing?",True
Should we reduce the age at which children are allowed to drink alcohol?,True
Should we allow some of the land owned by the royal family to be sold off?,True
Should we adopt a universal basic income?,True
Is it a good idea to allow private companies to run prisons?,True
Is the UK's approach to the EU right or wrong?,True
Is the UK's departure from the EU a good thing for the country?,True
Should we use public funds to provide free childcare?,True
Is there a role for a minimum wage?,True
Should there be a higher tax on sugar in food and drinks?,True
Do we need to change the law to regulate the spread of fake news?,True
Should the UK adopt a universal basic income?,True
Should companies be allowed to pay employees less than minimum wage as long as the company provides them with subsidized meals and housing?,True
Should we build more houses to tackle the UK’s housing shortage?,True
Should the government of a country intervene in the affairs of another country?,True
Should the UK build a moon base?,True
Should the UK government spend money on research into space travel?,True
Do we need a sugar tax?,True
Should it be illegal to smoke in one's home?,True
Should the government increase funding to train professional musicians?,True
Should we be able to buy a car without having a license?,True
Should we impose higher taxes on the richest people?,True
Should the government use drones to monitor for criminal activity?,True
Should the police and security services be allowed to use drones to gather information?,True
Should we ban the sale of non-essential plastics?,True
Do artificial intelligence systems make fair decisions?,True
Is marijuana as harmful as alcohol?,True
Should people with more money be forced to pay more taxes?,True
Is there anything wrong with cloning animals?,True
Should we force tech companies to block pornography and gambling?,True
Would it be a good idea to make all school uniforms gender neutral?,True
Will the world ever reach a point of zero inequality?,True
Should there be a national register of the genetic codes of all the population?,True
Would it be a good idea to introduce a new higher-tier of income tax rate?,True
Should children be able to access their genomic information without the consent of their parents?,True
Should Scotland be independent?,True
Should the UK have an opt-out organ donation scheme?,True
Should the government spend more money on building more nuclear power stations?,True
Has the internet made the world a better place?,True
Is it okay to eat genetically modified foods?,True
Should the UK maintain its current levels of defence spending?,True
Should we build new nuclear power stations in the UK?,True
Should the government be making its own medicines instead of importing them?,True
Should there be a maximum price on houses?,True
Should the law require new houses to be net zero carbon?,True
Should we ban all use of insecticides and pesticides?,True
Should the government spend less on the military?,True
Is capitalism a fair and sustainable economic system?,True
Is obesity a worse health risk than alcoholism?,True
Will climate change one day make the UK too hot to live in?,True
Should it be legal to offer cash rewards for anyone who can solve the worlds biggest problems?,True
Should the right to vote be extended to children?,True
Is human population growth a good thing?,True
Should the BBC be funded by tax-payer money?,True
Should the government spend more on road repairs?,True
Do we need an independent body to audit and investigate the work of the police?,True
Should we encourage high-earning students to stay in the UK by offering them special scholarships?,True
Should people be able to vote by internet?,True
Should government ministers be allowed to use private flights?,True
Is the Universal Basic Income a good idea?,True
Should the government be able to use CCTV footage to solve crimes?,True
Should the law be changed to ban all advertisements of unhealthy foods?,True
Does the minimum wage need to be raised?,True
Is it better to have a single-party or a multi-party government?,True
Should we ban people from visiting certain websites in the UK?,True
Are there any questions that we should never allow people to discuss and to vote on?,True
Should the UK stop burning coal in order to reduce greenhouse gas emissions?,True
Should there be a national identity card for all people in the UK?,True
Are the police doing all they can to deal with the knife crime epidemic?,True
Is it okay for doctors to withhold pain medication from patients who are addicted to opioids?,True
